result/Global Metrics/Global Metrics.csv

方向,LLM,图片总数,编译通过数,编译通过率(%),颜色直方图-平均分,CLIP-平均分
KOTLIN,deepseek (post),75,49,65.33,0.3371,0.563
KOTLIN,glm (post),75,60,80,0.5268,0.7057
KOTLIN,gpt (post),75,68,90.67,0.5601,0.7889
KOTLIN,kimi-turbo (post),75,52,69.33,0.3923,0.599
KOTLIN,gpt (a3),75,38,50.67,0.2794,0.4353
KOTLIN,gpt (a2),75,10,13.33,0.0852,0.1141
KOTLIN,gpt(nocolor),75,46,61.33,0.3369,0.5343
SWIFT,deepseek (post),75,41,54.67,0.2877,0.4766
SWIFT,glm (post),75,33,44,0.2851,0.3987
SWIFT,gpt (post),75,40,53.33,0.3023,0.4559
SWIFT,kimi-turbo (post),75,18,24,0.1333,0.21
SWIFT,gpt (a3),75,16,21.33,0.1442,0.1886
SWIFT,gpt (a2),75,6,8,0.0458,0.0683
SWIFT,gpt(nocolor),75,32,42.67,0.2104,0.3872

README.md

## 1 Overview

Extensive experiments demonstrate that LLMs with direct/one-shot prompting cannot translate a single compilable UI page. In contrast, at most 90.67% ArkTrans-translated files can be successfully compiled with high visual fidelity.

## 8 Results

For KJC/SwiftUI-to-ArkUI translations with GPT-5.2 as the backbone, ArkTrans achieves a Compilation Success Rate at 53.33%–90.67%. Regarding the visual fidelity, ArkTrans obtains a CLIP Similarity score of 45.59%–78.89% and a Color Histogram Similarity score of 30.23%–56.01% from the perspective of global metrics. Towards the local metrics, ArkTrans still maintains its superiority. It achieves a Position Score of 23.00%–46.60%, a Size Score of 24.70%–46.20%, a Color Score of 23.70%–45.40%, and a Text Integrity score of 47.70%–82.50%.